Website,Title,Content
https://en.wikipedia.org/wiki/Organism,Organism,"
 An organism (from Ancient Greek  ὄργανον (órganon) 'instrument, implement, tool', and  -ισμός (-ismós)) is any biological living system that functions as an individual life form.[1] All organisms are composed of cells (cell theory).[1] The idea of organism is based on the concept of minimal functional unit of life. Three traits have been proposed to play the main role in qualification as an organism:
 Organisms include multicellular animals, plants, and fungi; or unicellular microorganisms such as protists, bacteria, and archaea.[5] All types of organisms are capable of reproduction, growth and development, maintenance, and some degree of response to stimuli. Most multicellular organisms differentiate into specialized tissues and organs during their development.
 A unicellular organism may be either a prokaryote or a eukaryote. Prokaryotes are represented by two separate domains – bacteria and archaea. Eukaryotic organisms are characterized by the presence of a membrane-bound cell nucleus and contain additional membrane-bound compartments called organelles (such as mitochondria in animals and plants and plastids in plants and algae, all generally considered to be derived from endosymbiotic bacteria).[6] Fungi, animals and plants are examples of kingdoms of organisms within the eukaryotes.
 Estimates on the number of Earth's current species range from 2 million to 1 trillion,[7] of which over 1.7 million have been documented.[8] More than 99% of all species, amounting to over five billion species,[9] that ever lived are estimated to be extinct.[10][11]
 In 2016, a set of 355 genes from the last universal common ancestor (LUCA) of all organisms from Earth was identified.[12][13]
"
https://en.wikipedia.org/wiki/Mitochondrion,Mitochondrion,"
 A mitochondrion (/ˌmaɪtəˈkɒndriən/;[1] PL mitochondria) is an organelle found in the cells of most eukaryotes, such as animals, plants and fungi. Mitochondria have a double membrane structure and use aerobic respiration to generate adenosine triphosphate (ATP), which is used throughout the cell as a source of chemical energy.[2] They were discovered by Albert von Kölliker in 1857[3] in the voluntary muscles of insects. The term mitochondrion was coined by Carl Benda in 1898. The mitochondrion is popularly nicknamed the ""powerhouse of the cell"", a phrase coined by Philip Siekevitz in a 1957 article of the same name.[4]
 Some cells in some multicellular organisms lack mitochondria (for example, mature mammalian red blood cells). A large number of unicellular organisms, such as microsporidia, parabasalids and diplomonads, have reduced or transformed their mitochondria into other structures.[5] One eukaryote, Monocercomonoides, is known to have completely lost its mitochondria,[6] and one multicellular organism, Henneguya salminicola, is known to have retained mitochondrion-related organelles in association with a complete loss of their mitochondrial genome.[6][7][8]
 Mitochondria are commonly between 0.75 and 3 μm2 in cross section,[9] but vary considerably in size and structure. Unless specifically stained, they are not visible. In addition to supplying cellular energy, mitochondria are involved in other tasks, such as signaling, cellular differentiation, and cell death, as well as maintaining control of the cell cycle and cell growth.[10] Mitochondrial biogenesis is in turn temporally coordinated with these cellular processes.[11][12] Mitochondria have been implicated in several human disorders and conditions, such as mitochondrial diseases,[13] cardiac dysfunction,[14] heart failure[15] and autism.[16]
 The number of mitochondria in a cell can vary widely by organism, tissue, and cell type. A mature red blood cell has no mitochondria,[17] whereas a liver cell can have more than 2000.[18][19] The mitochondrion is composed of compartments that carry out specialized functions. These compartments or regions include the outer membrane, intermembrane space, inner membrane, cristae, and matrix.
 Although most of a eukaryotic cell's DNA is contained in the cell nucleus, the mitochondrion has its own genome (""mitogenome"") that is substantially similar to bacterial genomes.[20] This finding has led to general acceptance of the endosymbiotic hypothesis - that free-living prokaryotic ancestors of modern mitochondria permanently fused with eukaryotic cells in the distant past, evolving such that modern animals, plants, fungi, and other eukaryotes are able to respire to generate cellular energy.[21]
"
https://en.wikipedia.org/wiki/Plastid,Plastid,"
 The plastid (Greek: πλαστός; plastós: formed, molded – plural plastids) is a membrane-bound organelle[1] found in the cells of plants, algae, and some other eukaryotic organisms. They are considered to be intracellular endosymbiotic cyanobacteria. Examples include chloroplasts (used for photosynthesis), chromoplasts (used for pigment synthesis and storage), and leucoplasts (non-pigmented plastids that can sometimes differentiate).
 The event which led to permanent endosymbiosis in the Archaeplastida clade (of land plants, red algae, and green algae) probably occurred with a cyanobiont (a symbiotic cyanobacteria) related to the genus Gloeomargarita, around 1.5 billion years ago.[2][3] A later primary endosymbiosis event occurred in photosynthetic Paulinella amoeboids about 90–140 million years ago. This plastid belongs to the ""PS-clade"" (of the cyanobacteria genera Prochlorococcus and Synechococcus).[4][5] Secondary and tertiary endosymbiosis has also occurred, in a wide variety of organisms; additionally, some organisms sequester ingested plastids in a process that is known as kleptoplasty.
 A. F. W. Schimper was the first to name and provide a clear definition of plastids.[6][a] They often contain pigments used in photosynthesis, and the types of pigments in a plastid determine the cell's color. They are also the site of manufacture and storage of important chemical compounds used by the cells of autotrophic eukaryotes. They possess a double-stranded DNA molecule that is circular, like that of the circular chromosome of prokaryotic cells. Even in organisms where the plastids have lost their photosynthetic properties, the plastid is kept because of its essential role in the production of molecules like the isoprenoids.[8]
"
https://en.wikipedia.org/wiki/Cytoskeleton,Cytoskeleton,"The cytoskeleton is a complex, dynamic network of interlinking protein filaments present in the cytoplasm of all cells, including those of bacteria and archaea.[1] In eukaryotes, it extends from the cell nucleus to the cell membrane and is composed of similar proteins in the various organisms. It is composed of three main components, microfilaments, intermediate filaments and microtubules, and these are all capable of rapid growth or disassembly dependent on the cell's requirements.[2]
 A multitude of functions can be performed by the cytoskeleton. Its primary function is to give the cell its shape and mechanical resistance to deformation, and through association with extracellular connective tissue and other cells it stabilizes entire tissues.[3][4] The cytoskeleton can also contract, thereby deforming the cell and the cell's environment and allowing cells to migrate.[5] Moreover, it is involved in many cell signaling pathways and in the uptake of extracellular material (endocytosis),[6] the segregation of chromosomes during cellular division,[3] the cytokinesis stage of cell division,[7] as scaffolding to organize the contents of the cell in space[5] and in intracellular transport (for example, the movement of vesicles and organelles within the cell)[3] and can be a template for the construction of a cell wall.[3] Furthermore, it can form specialized structures, such as flagella, cilia, lamellipodia and podosomes. The structure, function and dynamic behavior of the cytoskeleton can be very different, depending on organism and cell type.[3][8][7] Even within one cell, the cytoskeleton can change through association with other proteins and the previous history of the network.[5]
 A large-scale example of an action performed by the cytoskeleton is muscle contraction. This is carried out by groups of highly specialized cells working together. A main component in the cytoskeleton that helps show the true function of this muscle contraction is the microfilament. Microfilaments are composed of the most abundant cellular protein known as actin.[9] During contraction of a muscle, within each muscle cell, myosin molecular motors collectively exert forces on parallel actin filaments. Muscle contraction starts from nerve impulses which then causes increased amounts of calcium to be released from the sarcoplasmic reticulum. Increases in calcium in the cytosol allows muscle contraction to begin with the help of two proteins, tropomyosin and troponin.[9] Tropomyosin inhibits the interaction between actin and myosin, while troponin senses the increase in calcium and releases the inhibition.[10] This action contracts the muscle cell, and through the synchronous process in many muscle cells, the entire muscle.
"
"https://en.wikipedia.org/wiki/Cell_wall,https://en.wikipedia.org/wiki/Cell_membrane","Cell wall,https://en.wikipedia.org/wiki/Cell membrane",
